{
  "$schema": "https://json-schema.org/draft/2020-12/schema",
  "$id": "https://schemas.archresidencebd.app/bbs/0.1.0.json",
  "title": "BarBendingSchedule",
  "description": "ArchResidenceBD BBS v0.1.0 (plan section 6, Appendix C W2.4) - the Bar Bending Schedule as data. A mark is one bar shape repeated: its length is the centreline length (the industry convention for bent bars) and its count is how many times it occurs. The weight follows the pi/4 * d^2 law times the steel density, and the same steel is measured from the geometry by the CAD engine (spike S5) - the two numbers must agree. Shapes beyond 'straight'/'link'/'starter' are reserved for the richer detailing later. Generated by archres_core.design.rebar; the shape list and the title block are W3.4's job.",
  "type": "object",
  "additionalProperties": false,
  "required": ["schemaVersion", "projectId", "items", "totals", "densityKgPerM3", "assumptions"],
  "properties": {
    "schemaVersion": { "const": "0.1.0" },
    "projectId": { "type": "string", "minLength": 1 },
    "items": {
      "type": "array",
      "minItems": 1,
      "items": { "$ref": "#/$defs/BbsItem" }
    },
    "totals": { "$ref": "#/$defs/BbsTotals" },
    "densityKgPerM3": {
      "type": "number",
      "exclusiveMinimum": 0,
      "description": "The steel density the weights were computed with (mild steel: 7850)."
    },
    "assumptions": {
      "type": "array",
      "items": { "$ref": "#/$defs/Assumption" },
      "description": "The authored detailing values the schedule rests on, with their reasons."
    }
  },
  "$defs": {
    "BbsItem": {
      "type": "object",
      "additionalProperties": false,
      "required": ["mark", "member", "role", "shape", "diameterMm", "lengthMm", "count", "weightKg"],
      "properties": {
        "mark": {
          "type": "string",
          "minLength": 1,
          "description": "Stable mark id, e.g. 'C1-MAINS'. The mark is the drawing's handle on the bar."
        },
        "member": {
          "type": "string",
          "minLength": 1,
          "description": "The structural member the bar belongs to (a column, a beam, a footing, a slab)."
        },
        "role": {
          "type": "string",
          "minLength": 1,
          "description": "What the bar does in the member: mains, links, mesh, distribution, starters."
        },
        "shape": {
          "type": "string",
          "enum": ["straight", "link", "bent", "hook", "starter"],
          "description": "The bar shape. v0 builds straight bars, links and starters; the rest are reserved."
        },
        "diameterMm": { "type": "number", "exclusiveMinimum": 0 },
        "lengthMm": {
          "type": "number",
          "exclusiveMinimum": 0,
          "description": "The centreline length of one bar of this mark (a link is its perimeter)."
        },
        "count": { "type": "integer", "minimum": 1 },
        "weightKg": {
          "type": "number",
          "minimum": 0,
          "description": "count * length * pi/4 d^2 * density, rounded to 4 decimals."
        }
      }
    },
    "BbsTotals": {
      "type": "object",
      "additionalProperties": false,
      "required": ["barCount", "weightKg", "byDiameterKg"],
      "properties": {
        "barCount": { "type": "integer", "minimum": 0 },
        "weightKg": { "type": "number", "minimum": 0 },
        "byDiameterKg": {
          "type": "object",
          "description": "The weight per diameter, keyed by the diameter in millimetres.",
          "additionalProperties": { "type": "number", "minimum": 0 }
        }
      }
    },
    "Assumption": {
      "type": "object",
      "additionalProperties": false,
      "required": ["pointer", "value", "unit", "reason"],
      "properties": {
        "pointer": { "type": "string", "minLength": 1 },
        "value": { "type": "number" },
        "unit": { "type": "string", "minLength": 1 },
        "reason": { "type": "string", "minLength": 1 }
      }
    }
  }
}
